{
  "attestation_type": "releasegate.release_attestation",
  "decision": {
    "decision": "BLOCK",
    "reason_codes": [
      "RISK_HIGH"
    ],
    "risk_score": 0.73
  },
  "decision_id": "1451dcc400a407479b593028f5c2caf9",
  "engine_version": "2.0.0",
  "evidence": {
    "checkpoint_hashes": [],
    "decision_bundle_hash": "sha256:d896ad486514364ee6f10af285a2a6bd2bda36dd9fb826e6eed00b2027056ff8",
    "signals_summary": {
      "approvals": {
        "count": 0
      },
      "files": {
        "changed": 42
      }
    }
  },
  "issued_at": "2026-02-10T23:21:00Z",
  "issuer": {
    "app_id": "releasegate",
    "environment": "dev",
    "key_id": "rg-local-2026-01",
    "org_id": "tenant-demo"
  },
  "policy": {
    "policy_bundle_hash": "bundlehashdemo",
    "policy_hash": "sha256:policyhashdemo",
    "policy_version": "1.0.0"
  },
  "schema_version": "1.0.0",
  "signature": {
    "algorithm": "ed25519",
    "signature_bytes": "F7P9/1k30ikNVydhyMZpMasvwZb8hM0pcvPeS8TXDyXVSyKyz/+O7UAXuzpkeEf96SZRvcyzp38/3520sZjdDA==",
    "signed_payload_hash": "sha256:c8e8d676d9857ece5d0f5288deb890b3c81498814a018856d35566f1ee83f255"
  },
  "subject": {
    "build_id": null,
    "commit_sha": "abc123def456",
    "merge_sha": null,
    "pr_number": 184,
    "release_id": null,
    "repo": "org/service-api"
  },
  "tenant_id": "tenant-demo"
}